,text,text_preprocessed,LEN,label,score,aff_lcs,aff_lcs_label
43,"Arroyo Naranjo se yon minisipalite nan vil Habana, nan peyi [[Kiba]].",Arroyo Naranjo se yon minisipalite nan vil Habana nan peyi Kiba,11,0,53.79421076436002,9,0-9
44,Nenpòt kote ki gen lè e yon bagay kapab jwenn [[plas]].,Nenpòt kote ki gen lè e yon bagay kapab jwenn plas,11,0,53.79421076436002,0,0-0
45,Duelo de pasiones se yon telenovela meksikèn pwodui pa [[Telesistema Mexicano]] [[S.A.]],Duelo de pasiones se yon telenovela meksikèn pwodui pa Telesistema_Mexicano SA,11,0,53.79421076436002,0,0-0
46,"Federal Way se yon vil nan eta [[Washington]], nan [[Etazini]].",Federal Way se yon vil nan eta Washington nan Etazini,10,0,53.79421076436002,3,0-3
47,"Guamajal se yon vil nan pwovens Villa Clara, nan peyi [[Kiba]].",Guamajal se yon vil nan pwovens Villa Clara nan peyi Kiba,11,0,53.79421076436002,8,0-8
6,Li se Pwofesè e manm fondatè Asosyasyon Pwofesè Lang Kreyòl Nò/[[Nòdès]].,Li se Pwofesè e manm fondatè Asosyasyon Pwofesè Lang Kreyòl NòNòdès,11,9,53.56060606060606,2,9-2
11,"Tembladera se yon vil nan pwovens Matanzas, nan peyi [[Kiba]].",Tembladera se yon vil nan pwovens Matanzas nan peyi Kiba,10,9,53.56060606060606,5,9-5
10,"Chorrerón se yon vil nan pwovens Sancti Spiritus, nan peyi [[Kiba]].",Chorrerón se yon vil nan pwovens Sancti Spiritus nan peyi Kiba,11,9,53.56060606060606,0,9-0
9,"La Regente se yon vil nan pwovens Matanzas, nan peyi [[Kiba]].",La Regente se yon vil nan pwovens Matanzas nan peyi Kiba,11,9,53.56060606060606,5,9-5
8,"North Fairfield se yon vil nan eta Ohio , nan [[Etazini]].",North Fairfield se yon vil nan eta Ohio nan Etazini,10,9,53.56060606060606,4,9-4
7,"Melha Bedia, ki fèt [[22 desanm]] 1990, se yon aktris ak imoris fransèz.",Melha Bedia ki fèt _desanm se yon aktris ak imoris fransèz,11,9,53.56060606060606,3,9-3
1,"La Esmeralda se yon vil nan pwovens Camaguey, nan peyi [[Kiba]].",La Esmeralda se yon vil nan pwovens Camaguey nan peyi Kiba,11,9,53.56060606060606,0,9-0
5,"La Prairie se yon vil nan eta Wisconsin, nan [[Etazini]].",La Prairie se yon vil nan eta Wisconsin nan Etazini,10,9,53.56060606060606,4,9-4
4,T se [[glif]] ki reprezante yon lèt nan kèk alfabèt.,T se glif ki reprezante yon lèt nan kèk alfabèt,10,9,53.56060606060606,1,9-1
3,"El Perú se yon vil nan pwovens Habana, nan peyi [[Kiba]].",El Perú se yon vil nan pwovens Habana nan peyi Kiba,11,9,53.56060606060606,0,9-0
2,"San Juan se yon vil nan pwovens Camaguey, nan peyi [[Kiba]].",San Juan se yon vil nan pwovens Camaguey nan peyi Kiba,11,9,53.56060606060606,0,9-0
0,"El Salado se yon vil nan pwovens Cienfuegos, nan peyi [[Kiba]].",El Salado se yon vil nan pwovens Cienfuegos nan peyi Kiba,11,9,53.56060606060606,0,9-0
0,[[Mo]] sosyete a pa vle tande ap soti nan bouch moun.,Mo sosyete a pa vle tande ap soti nan bouch moun,11,6,53.06666666666667,1,6-1
1,"Franka Potente, ki fèt [[22 jiyè]] 1974 nan Münster ([[Almay]]), se yon aktris [[alman]].",Franka Potente ki fèt _jiyè nan Münster se yon aktris alman,11,6,53.06666666666667,0,6-0
2,"Myrrha Saavedra, ki fèt [[12 me]] 1949 nan [[Meksiko]] ([[Meksik]]), se yon aktris meksikèn.",Myrrha Saavedra ki fèt _me nan Meksiko se yon aktris meksikèn,11,6,53.06666666666667,0,6-0
3,"Apodaca se yon vil nan pwovens Matanzas, nan peyi [[Kiba]].",Apodaca se yon vil nan pwovens Matanzas nan peyi Kiba,10,6,53.06666666666667,1,6-1
4,"Savan te reyini ansanm ak fonde òganizasyon ""[[Akademi Kreyòl Ayisyen]]"" an  Òganizasyon.",Savan te reyini ansanm ak fonde òganizasyon Akademi_Kreyòl_Ayisyen an Òganizasyon,10,6,53.06666666666667,2,6-2
5,"Peñas Atlas se yon vil nan pwovens Habana, nan peyi [[Kiba]].",Peñas Atlas se yon vil nan pwovens Habana nan peyi Kiba,11,6,53.06666666666667,1,6-1
